{
    "id": "content-not-found-on-dp",
    "scope": "CrossScope",
    "confidence": 75,
    "version": "1.0",
    "authoredAt": "2026-04-24",
    "authoredBy": "jason",
    "source": "baseline",
    "when": {
        "all": [
            { "signature": "DP-002" }
        ]
    },
    "verdict": "The distribution point was reachable but did not hold the requested content. The content was never distributed or distribution is incomplete.",
    "evidence": [
        { "component": "CAS", "match": "content location" },
        { "component": "ContentTransferManager", "match": "not found" }
    ],
    "fix": "In the console, open the package or application and check `Content Status`. Redistribute to the target DP (or the DP group) if the status is `Failed`, `In Progress`, or missing. If the content source path on the site server is unreachable (wrong UNC, permissions), distribution will keep failing until the source is fixed.",
    "references": [
        "https://learn.microsoft.com/mem/configmgr/core/servers/deploy/configure/install-and-configure-distribution-points",
        "https://learn.microsoft.com/mem/configmgr/apps/deploy-use/monitor-applications-from-the-console"
    ]
}
